[
{
"title": "2-for-1 Apps on Gameday",
"biz": "Old City Grill",
"area": "Old City",
"time": "Gameday only",
"link": "https://example.com/menu"
},
{
"title": "$12 Large 1‑Topping Post‑Game",
"biz": "The Strip Pizza Co.",
"area": "The Strip",
"time": "Post‑game (Home games)",
"link": "https://example.com/deals"
}
]
